{"bounds":{"max_steps":16},"correspondence":{"classification":"bounded-trace-correspondence","implementation_source_sha256":"6666666666666666666666666666666666666666666666666666666666666666","observation_definition_sha256":"7777777777777777777777777777777777777777777777777777777777777777","operation_map":[{"implementation":"OP-0000","model":"begin"}],"state_map":[{"implementation":"STATE-0000","model":"ready"}],"trace":[{"implementation_operation":"OP-0000","implementation_state":"STATE-0000","model_operation":"begin","model_state":"ready","observation_sha256":"ffffffffffffffffffffffffffffffffffffffffffffffffffffffffffffffff","sequence":0}],"trace_sha256":"45486f194b0a8fd76096f820538e33c2f702e9812299c9b09075678caa1a3685"},"kind":"formal-execution-receipt","limitations":["Execution is evaluated only within the declared finite bounds.","Counterexample sensitivity is established only for the declared negative model.","Implementation trace correspondence is caller-declared and is not a refinement proof.","Consumer-native gates remain authoritative and are not replaced by this receipt."],"model":{"config_sha256":"dddddddddddddddddddddddddddddddddddddddddddddddddddddddddddddddd","id":"MODEL-DEMO","language":"tla-plus","operations":["begin"],"source_sha256":"cccccccccccccccccccccccccccccccccccccccccccccccccccccccccccccccc","states":["ready"]},"non_claims":["implementation-refinement","liveness-proof","unbounded-proof","universal-equivalence"],"receipt_id":"FORMAL-RECEIPT-DEMO","result":{"counterexample_sha256":null,"explored_states":16,"explored_transitions":15,"outcome":"exhausted","result_sha256":"2222222222222222222222222222222222222222222222222222222222222222","status":"pass"},"run":{"argv_sha256":"1111111111111111111111111111111111111111111111111111111111111111","attempt":1,"id":"RUN-DEMO"},"schema_version":2,"sensitivity":{"bounds_sha256":"f2d438ef3265bf1e3cacd49ab9ccc0577006d767fb6a298be71b57bddaaecd29","config_sha256":"4444444444444444444444444444444444444444444444444444444444444444","counterexample_sha256":"5555555555555555555555555555555555555555555555555555555555555555","expected_outcome":"counterexample","model_sha256":"3333333333333333333333333333333333333333333333333333333333333333","mutation_id":"MUTATION-DEMO","mutation_sha256":"6666666666666666666666666666666666666666666666666666666666666666","observed_outcome":"counterexample","result_sha256":"7777777777777777777777777777777777777777777777777777777777777777","run_sha256":"c1906cb47192a896d4a46fddbaab335d378047cea369e81827334ad34345a751","tool_sha256":"c8c56cabc7065d7e7af634aeafda3aa11d7f05d48e893c0ef5fc8e46639094aa"},"source":{"commit":"aaaaaaaaaaaaaaaaaaaaaaaaaaaaaaaaaaaaaaaa","tree":"bbbbbbbbbbbbbbbbbbbbbbbbbbbbbbbbbbbbbbbb"},"tool":{"adapter_id":"ADAPTER-FORMAL-MODEL-TLC","executable_sha256":"eeeeeeeeeeeeeeeeeeeeeeeeeeeeeeeeeeeeeeeeeeeeeeeeeeeeeeeeeeeeeeee","name":"tlc","version":"1.8.0"}}
